,PropertyName,Address,Price,No_Bedrooms,No_Bathrooms,Floorsize,Property_Type,Tenure,PSF,link,Latitude,Longitude,District,State
263,Sky Semi D Condo Bukit Jalil Pavillion 2,"Bukit Jalil, Kuala Lumpur",500000,3,2,1100,Condominium,Leasehold,454.55,https://www.propertyguru.com.my/propertylisting/skysemidcondobukitjalilpavillion2forsalebyedwardtee36125921,3.0533462,101.6802937,Bukit Jalil, Kuala Lumpur
264,[ Below Market Price 40% ] 1400sqft 4Room 5 Star Condo Near Nilai,"ParkCity Heights, Desa ParkCity, Kuala Lumpur",329000,4,3,1400,Condominium,Freehold,235,https://www.propertyguru.com.my/propertylisting/belowmarketprice401400sqft4room5starcondonearnilaiforsalebyjoel35491563,3.1863832,101.6318156,Desa ParkCity, Kuala Lumpur
265,Last Few Unit Promotion Cashback Up To RM50k Big Layout Near Mall,"Mid Valley City, Kuala Lumpur",251000,4,3,1500,Condominium,Freehold,167.33,https://www.propertyguru.com.my/propertylisting/lastfewunitpromotioncashbackuptorm50kbiglayoutnearmallforsalebyjoel35392201,3.118506,101.6768457,Mid Valley City, Kuala Lumpur
266,LAST Condo MONTHLY RM850 [4R3B & 1350sqft] CASHBACK Up To RM50k,"Puchong, Kuala Lumpur",295000,4,3,1350,Condominium,Freehold,218.52,https://www.propertyguru.com.my/propertylisting/lastcondomonthlyrm8504r3b1350sqftcashbackuptorm50kforsalebyjoel35378002,3.0640269,101.6498472,Puchong, Kuala Lumpur
267,[Freehold] Bangsar 34 rooms | Monthly RM1500 | Free Furnish,"Bangsar, Kuala Lumpur",580000,3,2,1200,Condominium,Freehold,483.33,https://www.propertyguru.com.my/propertylisting/freeholdbangsar34roomsmonthlyrm1500freefurnishforsalebyjoel35458304,3.13083,101.66944,Bangsar, Kuala Lumpur
268,Sungai Besi Bukit Jalil Duplex Sky Condo 3 Bedrooms 2 Bathroom,"Sungai Besi, Kuala Lumpur",530000,3,2,1180,Condominium,Leasehold,449.15,https://www.propertyguru.com.my/propertylisting/sungaibesibukitjalilduplexskycondo3bedrooms2bathroomforsalebyedwardtee36163022,3.0637899,101.7080021,Sungai Besi, Kuala Lumpur
269,New condo Bandar Tasik Selatan,"Bandar Tasik Selatan, Kuala Lumpur",412000,3,2,946,Apartment,Leasehold,435.52,https://www.propertyguru.com.my/propertylisting/newcondobandartasikselatanforsalebyzulfarhansamajamal36208657,3.07609695,101.7114468,Bandar Tasik Selatan, Kuala Lumpur
270,Pavilion Damansara Heights,"Jalan Damanlela, Damansara Heights, Kuala Lumpur",1323540,2,2,826,New Project,Unknown,1602.35,https://www.propertyguru.com.my/propertylisting/paviliondamansaraheightsforsalebynicolehow33602397,3.1523954,101.6584455,Damansara Heights, Kuala Lumpur
271,Sentul Point Suite Apartment,"Jalan Sentul Pasar, Sentul, Kuala Lumpur",330000,3,2,901,Apartment,Freehold,366.26,https://www.propertyguru.com.my/propertylisting/sentulpointsuiteapartmentforsalebyjasonlim35820112,3.1786181,101.6954775,Sentul, Kuala Lumpur
272,M Centura,"No 25 Jalan Sentul Pasar, Batu, Sentul, Kuala Lumpur",330000,2,2,950,New Project,Unknown,347.37,https://www.propertyguru.com.my/propertylisting/mcenturaforsalebyjasonlim35819733,3.1786181,101.6954775,Sentul, Kuala Lumpur
273,M Arisa,"25 Jalan Sentul Pasar, Sentul, Kuala Lumpur",320000,2,2,708,New Project,Unknown,451.98,https://www.propertyguru.com.my/propertylisting/marisaforsalebyjasonlim35799974,3.1786181,101.6954775,Sentul, Kuala Lumpur
274,Gembira Residen (G Residence),"Jalan Senang Ria, Off Jalan Gembira, Happy Garden, Kuchai Lama, Kuala Lumpur",868000,4,3,1488,Condominium,Freehold,583.33,https://www.propertyguru.com.my/propertylisting/gembiraresidengresidenceforsalebydanielwu36406540,3.0894376,101.6846759,Kuchai Lama, Kuala Lumpur
275,Expressionz Professional Suites,"Jalan Tun Razak, Titiwangsa, Kuala Lumpur",800000,2,2,651,Condominium,Leasehold,1228.88,https://www.propertyguru.com.my/propertylisting/expressionzprofessionalsuitesforsalebyyennyyap36354441,3.17401135,101.6956176,Titiwangsa, Kuala Lumpur
276,KLCC Semi D Condo Fully Furnished | RM3. 5k Salary to Own | Walking Distance to MRT/LRT/KTM,"KLCC, KL City, Kuala Lumpur",450000,4,2,1000,Condominium,Freehold,450,https://www.propertyguru.com.my/propertylisting/klccsemidcondofullyfurnishedrm35ksalarytoownwalkingdistancetomrtlrtktmforsalebyjasonlim36355917,47.3776542,8.538495,KL City, Kuala Lumpur
277,Sunway Velocity Sunway Velocity Sunway Velocity,"Taman Maluri, Cheras, Kuala Lumpur",400000,3,2,1000,Condominium,Freehold,400,https://www.propertyguru.com.my/propertylisting/sunwayvelocitysunwayvelocitysunwayvelocityforsalebyjasonlim36355835,3.0991919,101.7374229,Cheras, Kuala Lumpur
278,Trinity Pentamont,"Jalan Kiara 5, Mont Kiara, Mont Kiara, Kuala Lumpur",1533000,4,5,2085,New Project,Unknown,735.25,https://www.propertyguru.com.my/propertylisting/trinitypentamontforsalebyteekaishiang35715670,3.1699988,101.6521467,Mont Kiara, Kuala Lumpur
279,The Tamarind @ Sentul East," Jalan Sentul, Sentul, Kuala Lumpur",420000,2,2,1000,Condominium,Freehold,420,https://www.propertyguru.com.my/propertylisting/thetamarindsentuleastforsalebydcleong36469263,3.1786181,101.6954775,Sentul, Kuala Lumpur
280,Allevia Mont'Kiara,"Jln Kiara 4, Mont Kiara, Kuala Lumpur",2090000,4,5,2345,New Project,Unknown,891.26,https://www.propertyguru.com.my/propertylisting/alleviamontkiaraforsalebyryantan35864751,3.1699988,101.6521467,Mont Kiara, Kuala Lumpur
281,Vista Amani Condominium," Jalan Tasik Permaisuri 3, Cheras, Kuala Lumpur",639000,5,4,2125,Condominium,Leasehold,300.71,https://www.propertyguru.com.my/propertylisting/vistaamanicondominiumforsalebymschang36658922,3.0991919,101.7374229,Cheras, Kuala Lumpur
282,Monthly RM 950 Rental RM 1800 @ Beside University & Mall | Cash Rebate RM 120k Free Manage,"Bukit Bintang, KL City, Kuala Lumpur",200000,2,1,500,Condominium,Freehold,400,https://www.propertyguru.com.my/propertylisting/monthlyrm950rentalrm1800besideuniversitymallcashrebaterm120kfreemanageforsalebyjaniceteam36578975,47.3776542,8.538495,KL City, Kuala Lumpur
283,TRX Low density [Cashback 50K] Freehold Furnished Condo,"City Centre, KL City, Kuala Lumpur",505000,3,2,968,Condominium,Freehold,521.69,https://www.propertyguru.com.my/propertylisting/trxlowdensitycashback50kfreeholdfurnishedcondoforsalebyshellychoong36650186,47.3776542,8.538495,KL City, Kuala Lumpur
284,"Fully Furnished M Residence Condo , [7 Min to TRX & KL City Centre]","Taman Maluri, Cheras, Kuala Lumpur",399000,4,3,1000,Condominium,Freehold,399,https://www.propertyguru.com.my/propertylisting/fullyfurnishedmresidencecondo7mintotrxklcitycentreforsalebyernest35338858,3.0991919,101.7374229,Cheras, Kuala Lumpur
285,Bukit Jalil @ Taman OUG | FREEHOLD Residential Low Density Condo 5 Min To Pavilion 2 3B3R,"Taman Danau Desa, Taman Desa, Kuala Lumpur",639000,3,3,1200,Condominium,Freehold,532.5,https://www.propertyguru.com.my/propertylisting/bukitjaliltamanougfreeholdresidentiallowdensitycondo5mintopavilion23b3rforsalebyjaniceteam36628203,3.1030637,101.6850208,Taman Desa, Kuala Lumpur
286,First Home Buyer RM 120k Cash Rebate @ FULL LOAN | Monthly RM 950 Beside University & Mall,"Bukit Bintang, KL City, Kuala Lumpur",200000,2,1,500,Condominium,Freehold,400,https://www.propertyguru.com.my/propertylisting/firsthomebuyerrm120kcashrebatefullloanmonthlyrm950besideuniversitymallforsalebyjaniceteam36628271,47.3776542,8.538495,KL City, Kuala Lumpur
287,NEW TOWNSHIP【CHEAPEST FREEHOLD @RM199K RM199K】+ 100% LOAN + FREE MAINTENANCE + FREE SERVICES,"Desa ParkCity, Kuala Lumpur",199999,2,2,500,Condominium,Freehold,400,https://www.propertyguru.com.my/propertylisting/newtownshipcheapestfreeholdrm199krm199k100loanfreemaintenancefreeservicesforsalebyelaineyap36071232,3.1863832,101.6318156,Desa ParkCity, Kuala Lumpur
288,Paraiso Residence @ The Earth,"Jalan Jalil 2, Bukit Jalil, Kuala Lumpur",609000,3,2,1226,Condominium,Leasehold,496.74,https://www.propertyguru.com.my/propertylisting/paraisoresidencetheearthforsalebycalvinwong36356268,3.0533462,101.6802937,Bukit Jalil, Kuala Lumpur
289,Paraiso Residence @ The Earth,"Jalan Jalil 2, Bukit Jalil, Kuala Lumpur",641000,3,2,1226,Condominium,Leasehold,522.84,https://www.propertyguru.com.my/propertylisting/paraisoresidencetheearthforsalebycalvinwong36356219,3.0533462,101.6802937,Bukit Jalil, Kuala Lumpur
290,Westside III,"Jalan Residen Utama, Desa Parkcity, Kuala Lumpur, Desa ParkCity, Kuala Lumpur",1300000,3,3,1530,Condominium,Freehold,849.67,https://www.propertyguru.com.my/propertylisting/westsideiiiforsalebyjinteok36508090,3.1863832,101.6318156,Desa ParkCity, Kuala Lumpur
291,Kuala Lumpur Kuala Lumpur Kuala Lumpur,"KL City, Kuala Lumpur",300000,3,2,1000,Condominium,Freehold,300,https://www.propertyguru.com.my/propertylisting/kualalumpurkualalumpurkualalumpurforsalebykevinchai36124001,47.3776542,8.538495,KL City, Kuala Lumpur
292,Northpoint Residences,"1 Medan Syed Putra, Mid Valley City, Kuala Lumpur",1400000,3,2,1367,Condominium,Leasehold,1024.14,https://www.propertyguru.com.my/propertylisting/northpointresidencesforsalebydarrylling35409506,3.118506,101.6768457,Mid Valley City, Kuala Lumpur
293,Sentral Suites @ KL Sentral,"Jalan Tun Sambanthan, KL Sentral, Kuala Lumpur",973000,3,3,1025,New Project,Unknown,949.27,https://www.propertyguru.com.my/propertylisting/sentralsuitesklsentralforsalebyronyew35407413,3.13430685,101.6863691,KL Sentral, Kuala Lumpur
294,【RM2600 KLCC Infinity Pool 3mins walking to MRT】Airbnb Hotspot & Low Density,"Bukit Bintang, KL City, Kuala Lumpur",500000,2,2,650,Condominium,Freehold,769.23,https://www.propertyguru.com.my/propertylisting/rm2600klccinfinitypool3minswalkingtomrtairbnbhotspotlowdensityforsalebycassandrachung36602663,47.3776542,8.538495,KL City, Kuala Lumpur
295,Sri Penaga (Bangsar),"Jalan Medang Serai, Bukit Bandaraya, Bangsar, Kuala Lumpur",2250000,3,2,1948,Condominium,Freehold,1155.03,https://www.propertyguru.com.my/propertylisting/sripenagabangsarforsalebyshasha36435040,3.13083,101.66944,Bangsar, Kuala Lumpur
296,【First SemiD Concept Layout with Santorini Sky Pool】4R3B Only RM2300,"Old Klang Road (Jalan Klang Lama), Kuala Lumpur",570000,4,3,1300,Condominium,Freehold,438.46,https://www.propertyguru.com.my/propertylisting/firstsemidconceptlayoutwithsantoriniskypool4r3bonlyrm2300forsalebycassandrachung35895837,3.0982804,101.6762084,Old Klang Road (Jalan Klang Lama), Kuala Lumpur
297,【RM500K Freehold walking 300m to KLCC】Free Furnished & Low Density,"Jalan Sultan Ismail, KL City, Kuala Lumpur",500000,2,2,680,Condominium,Freehold,735.29,https://www.propertyguru.com.my/propertylisting/rm500kfreeholdwalking300mtoklccfreefurnishedlowdensityforsalebycassandrachung36583687,47.3776542,8.538495,KL City, Kuala Lumpur
298,Jalan Ipoh Freehold Luxury Condo linked to [LRT/MRT/KTM],"Jalan Ipoh, KL City, Kuala Lumpur",300000,3,2,1000,Condominium,Freehold,300,https://www.propertyguru.com.my/propertylisting/jalanipohfreeholdluxurycondolinkedtolrtmrtktmforsalebycjtiew36514805,47.3776542,8.538495,KL City, Kuala Lumpur
299,Pavilion Damansara Heights,"Jalan Damanlela, Damansara Heights, Kuala Lumpur",1280610,2,1,808,New Project,Unknown,1584.91,https://www.propertyguru.com.my/propertylisting/paviliondamansaraheightsforsalebykit34154956,3.1523954,101.6584455,Damansara Heights, Kuala Lumpur
300,Dynasty Garden Condominium,"Jalan Kuchai Maju 9, Kuchai Entrepreneurs Park, Old Klang Road (Jalan Klang Lama), Kuala Lumpur",448000,3,2,1120,Condominium,Leasehold,400,https://www.propertyguru.com.my/propertylisting/dynastygardencondominiumforsalebydanielwu36666425,3.0982804,101.6762084,Old Klang Road (Jalan Klang Lama), Kuala Lumpur
301,Gembira Residen (G Residence),"Jalan Senang Ria, Off Jalan Gembira, Happy Garden, Kuchai Lama, Kuala Lumpur",668000,3,2,1168,Condominium,Freehold,571.92,https://www.propertyguru.com.my/propertylisting/gembiraresidengresidenceforsalebydanielwu36666383,3.0894376,101.6846759,Kuchai Lama, Kuala Lumpur
302,The Goodwood Residence,"Jalan Pantai Permai, Bangsar South, Kuala Lumpur",1506000,5,5,2002,New Project,Unknown,752.25,https://www.propertyguru.com.my/propertylisting/thegoodwoodresidenceforsalebyconnielu36266374,3.1129733,101.6667294,Bangsar South, Kuala Lumpur
303,The Legacy OUG,"Taman OUG, Kuchai Lama, Kuala Lumpur",710800,3,2,1050,New Project,Unknown,676.95,https://www.propertyguru.com.my/propertylisting/thelegacyougforsalebyrainlim36665761,3.0894376,101.6846759,Kuchai Lama, Kuala Lumpur
304,Sentral Suites @ KL Sentral,"Jalan Tun Sambanthan, KL Sentral, Kuala Lumpur",828900,2,2,826,New Project,Unknown,1003.51,https://www.propertyguru.com.my/propertylisting/sentralsuitesklsentralforsalebyronyew35407369,3.13430685,101.6863691,KL Sentral, Kuala Lumpur
305,The Legacy OUG,"Taman OUG, Kuchai Lama, Kuala Lumpur",880800,4,4,1390,New Project,Unknown,633.67,https://www.propertyguru.com.my/propertylisting/thelegacyougforsalebyrainlim36649755,3.0894376,101.6846759,Kuchai Lama, Kuala Lumpur
306,Bandar Baru Sentul [ HOC Fully Furnished]  Township Direct Link LRT [Loan Subsidy],"Batu, Sentul, Kuala Lumpur",450000,3,2,1000,Condominium,Freehold,450,https://www.propertyguru.com.my/propertylisting/bandarbarusentulhocfullyfurnishedtownshipdirectlinklrtloansubsidyforsalebyvictorong33708325,3.1786181,101.6954775,Sentul, Kuala Lumpur
307,Sentul Point,"Sentul, Kuala Lumpur",320000,3,2,1051,Condominium,Freehold,304.47,https://www.propertyguru.com.my/propertylisting/sentulpointforsalebyvictorong34779262,3.1786181,101.6954775,Sentul, Kuala Lumpur
308,Kuala Lumpur Kuala Lumpur Kuala Lumpur Kuala Lumpur,"Bukit Bintang, KL City, Kuala Lumpur",385000,3,2,878,Condominium,Freehold,438.5,https://www.propertyguru.com.my/propertylisting/kualalumpurkualalumpurkualalumpurkualalumpurforsalebynatashatan36167031,47.3776542,8.538495,KL City, Kuala Lumpur
309,Setapak 3&4 Rooms Beside MRT,"Setapak Jaya, Setapak, Kuala Lumpur",388000,3,2,900,Condominium,Leasehold,431.11,https://www.propertyguru.com.my/propertylisting/setapak34roomsbesidemrtforsalebynatashatan36654870,3.1975774,101.7139655,Setapak, Kuala Lumpur
310,"210k Freehold Condo Baru【Gaji 2500 Blh Dpt 】2Bilik, 10k Cashback, Free 2 Years Maintenance","City Centre, KL City, Kuala Lumpur",210000,2,1,650,Condominium,Freehold,323.08,https://www.propertyguru.com.my/propertylisting/210kfreeholdcondobarugaji2500blhdpt2bilik10kcashbackfree2yearsmaintenanceforsalebyevelyn36366903,47.3776542,8.538495,KL City, Kuala Lumpur
311,Lakeville Residence,"Jalan Sibu Off Jalan Ipoh, Taman Wahyu, Jalan Ipoh, KL City, Kuala Lumpur",680000,3,2,978,Condominium,Leasehold,695.3,https://www.propertyguru.com.my/propertylisting/lakevilleresidenceforsalebyjaynegoh36664724,47.3776542,8.538495,KL City, Kuala Lumpur
312,Desa Pandan Apartment,"Jalan 2/76d, Kampung Pandan, Desa Pandan, Kuala Lumpur",355000,3,2,760,Apartment,Leasehold,467.11,https://www.propertyguru.com.my/propertylisting/desapandanapartmentforsalebyjadenyap34933884,3.1482687,101.7380746,Desa Pandan, Kuala Lumpur
313,Damansara Seresta,"Persiaran Meranti, Bandar Sri Menjalara, Bandar Menjalara, Kuala Lumpur",799999,3,2,1291,New Project,Unknown,619.67,https://www.propertyguru.com.my/propertylisting/damansaraserestaforsalebywiliamteng36265690,3.1941339,101.6272283,Bandar Menjalara, Kuala Lumpur
314,Pavilion Residences,"77 Jalan Raja Chulan Off Pavilion, Bukit Bintang, KL City, Kuala Lumpur",2640750,2,2,1508,Condominium,Leasehold,1751.16,https://www.propertyguru.com.my/propertylisting/pavilionresidencesforsalebysue32025819,47.3776542,8.538495,KL City, Kuala Lumpur
315,Casa Kiara 1," Jalan Kiara 3, Mont Kiara, Mont Kiara, Kuala Lumpur",690000,3,2,1236,Condominium,Freehold,558.25,https://www.propertyguru.com.my/propertylisting/casakiara1forsalebysue33631995,3.1699988,101.6521467,Mont Kiara, Kuala Lumpur
316,Riverville Residences,"Jalan Klang Lama Off Jalan Taman Sri Sentosa, Taman Sri Sentosa, Old Klang Road (Jalan Klang Lama), Kuala Lumpur",510300,4,3,1399,Condominium,Freehold,364.76,https://www.propertyguru.com.my/propertylisting/rivervilleresidencesforsalebyjoeylow36663974,3.0982804,101.6762084,Old Klang Road (Jalan Klang Lama), Kuala Lumpur
317,Segambut [Freehold] [Residential Title] [0 DownPayment] [Dual Key],"Dutamas, Segambut, Kuala Lumpur",480000,4,3,1239,Condominium,Freehold,387.41,https://www.propertyguru.com.my/propertylisting/segambutfreeholdresidentialtitle0downpaymentdualkeyforsalebyjonathansing36663845,3.1864418,101.6641964,Segambut, Kuala Lumpur
318,PSV 1 Residences @ Platinum South Valley,"Bandar Tasik Selatan, Kuala Lumpur",470000,4,2,1093,New Project,Unknown,430.01,https://www.propertyguru.com.my/propertylisting/psv1residencesplatinumsouthvalleyforsalebykhchoo36663706,3.07609695,101.7114468,Bandar Tasik Selatan, Kuala Lumpur
319,[Super Rare Duplex Condo] [Fully Furnished] [Free MOT],"Taman Pertama, Cheras, Kuala Lumpur",450800,3,2,1021,Condominium,Unknown,441.53,https://www.propertyguru.com.my/propertylisting/superrareduplexcondofullyfurnishedfreemotforsalebyquinnlee36645631,3.0991919,101.7374229,Cheras, Kuala Lumpur
320,The Northshore Gardens,"3 Persiaran Residen 2, Desa Parkcity, Desa ParkCity, Kuala Lumpur",2480000,4,5,2454,Condominium,Freehold,1010.59,https://www.propertyguru.com.my/propertylisting/thenorthshoregardensforsalebyjessiekee36564739,3.1863832,101.6318156,Desa ParkCity, Kuala Lumpur
321,Setia SKY Residences,"Jalan Raja Muda Abdul Aziz, Off Jalan Tun Razak, KLCC, KL City, Kuala Lumpur",1300000,4,4,1378,Condominium,Freehold,943.4,https://www.propertyguru.com.my/propertylisting/setiaskyresidencesforsalebykhchoo36589028,47.3776542,8.538495,KL City, Kuala Lumpur
322,PSV 1 Residences @ Platinum South Valley,"Bandar Tasik Selatan, Kuala Lumpur",412000,3,2,946,New Project,Unknown,435.52,https://www.propertyguru.com.my/propertylisting/psv1residencesplatinumsouthvalleyforsalebykhchoo36663644,3.07609695,101.7114468,Bandar Tasik Selatan, Kuala Lumpur
323,Seri Riana Residence,"Jln Wangsa Delima 7 Off Jalan Wangsa Perdana 1, Wangsa Maju, Wangsa Maju, Kuala Lumpur",1050000,4,4,1754,Condominium,Leasehold,598.63,https://www.propertyguru.com.my/propertylisting/seririanaresidenceforsalebyaimizamzuri36341129,3.20568905,101.7319923,Wangsa Maju, Kuala Lumpur
324,1 Sentul,"Jalan Sentul Pasar, Kuala Lumpur, Sentul, Kuala Lumpur",658000,4,2,1355,Condominium,Freehold,485.61,https://www.propertyguru.com.my/propertylisting/1sentulforsalebyaimizamzuri36417393,3.1786181,101.6954775,Sentul, Kuala Lumpur
325,Lakeville Residence,"Jalan Sibu Off Jalan Ipoh, Taman Wahyu, Jalan Ipoh, KL City, Kuala Lumpur",680000,3,2,1195,Condominium,Leasehold,569.04,https://www.propertyguru.com.my/propertylisting/lakevilleresidenceforsalebysherrenakoh34558606,47.3776542,8.538495,KL City, Kuala Lumpur
326,The Henge Kepong,"The Henge Jalan Metro Perdana Barat, Taman Usahawan Kepong, Kepong, Kuala Lumpur",465000,3,2,1100,Condominium,Leasehold,422.73,https://www.propertyguru.com.my/propertylisting/thehengekepongforsalebyansontan36246450,3.2140294,101.634842,Kepong, Kuala Lumpur
327,The Henge Kepong,"The Henge Jalan Metro Perdana Barat, Taman Usahawan Kepong, Kepong, Kuala Lumpur",580000,3,2,1100,Condominium,Leasehold,527.27,https://www.propertyguru.com.my/propertylisting/thehengekepongforsalebyansontan36031006,3.2140294,101.634842,Kepong, Kuala Lumpur
328,The Harmony @ Old Klang Road,"Old Klang Road (Jalan Klang Lama), Kuala Lumpur",485000,3,2,1033,New Project,Unknown,469.51,https://www.propertyguru.com.my/propertylisting/theharmonyoldklangroadforsalebylouischen34889542,3.0982804,101.6762084,Old Klang Road (Jalan Klang Lama), Kuala Lumpur
329,Sentul Utama Condominium," Jalan Dato Senu 26, Taman Sentul Utama, Sentul, Kuala Lumpur",380000,3,2,891,Condominium,Leasehold,426.49,https://www.propertyguru.com.my/propertylisting/sentulutamacondominiumforsalebysarifudinjamni36662227,3.1786181,101.6954775,Sentul, Kuala Lumpur
330,"Terra Springverve @ Suites KL, old klang road","old klang road (Jalan Klang Lama), Old Klang Road (Jalan Klang Lama), Kuala Lumpur",480000,1,1,555,Condominium,Freehold,864.86,https://www.propertyguru.com.my/propertylisting/terraspringvervesuiteskloldklangroadforsalebyalhanaahmad36284007,3.0982804,101.6762084,Old Klang Road (Jalan Klang Lama), Kuala Lumpur
331,Bukit Desa Condominium," Jalan Bukit Desa 3, Taman Desa, Kuala Lumpur",650000,3,2,1240,Condominium,Freehold,524.19,https://www.propertyguru.com.my/propertylisting/bukitdesacondominiumforsalebyshimrywong35690275,3.1030637,101.6850208,Taman Desa, Kuala Lumpur
332,Rumahwip Setapak,"Setapak Jaya, Setapak, Kuala Lumpur",300000,3,2,806,Condominium,Leasehold,372.21,https://www.propertyguru.com.my/propertylisting/rumahwipsetapakforsalebyamirulsolehin33268932,3.1975774,101.7139655,Setapak, Kuala Lumpur
333,M Oscar,"No. 6 Jalan Senang Ria, Taman Gembira, Old Klang Road (Kuchai Lama), Kuchai Lama, Kuala Lumpur",579096,3,2,895,New Project,Unknown,647.03,https://www.propertyguru.com.my/propertylisting/moscarforsalebykevinlee36034078,3.0894376,101.6846759,Kuchai Lama, Kuala Lumpur
334,Residensi Bintang Bukit Jalil,"Jalan Impian Indah, Bukit Jalil, Kuala Lumpur",566000,2,2,805,New Project,Unknown,703.11,https://www.propertyguru.com.my/propertylisting/residensibintangbukitjalilforsalebykevinlee35611412,3.0533462,101.6802937,Bukit Jalil, Kuala Lumpur
335,Royal Regent (Sri Putramas 3)," Jalan Dutamas 2, Jalan Kuching, KL City, Kuala Lumpur",460000,2,2,880,Condominium,Freehold,522.73,https://www.propertyguru.com.my/propertylisting/royalregentsriputramas3forsalebytroytan36453866,47.3776542,8.538495,KL City, Kuala Lumpur
336,Aira Residence,"Jalan Batai, Damansara Heights, Kuala Lumpur",5700000,3,4,2700,Condominium,Freehold,2111.11,https://www.propertyguru.com.my/propertylisting/airaresidenceforsalebythlee36381128,3.1523954,101.6584455,Damansara Heights, Kuala Lumpur
337,Stonor 3 @ KLCC,"Stonor 3 Lorong Stonor Off Persiaran Stonor, KLCC, KL City, Kuala Lumpur",1150000,2,2,871,Condominium,Freehold,1320.32,https://www.propertyguru.com.my/propertylisting/stonor3klccforsalebynicholasloo32224821,47.3776542,8.538495,KL City, Kuala Lumpur
338,18 Madge,"18 Jalan Madge, Ampang Hilir, Kuala Lumpur",2600000,4,5,2678,New Project,Unknown,970.87,https://www.propertyguru.com.my/propertylisting/18madgeforsalebynicholasloo36557978,3.1585208,101.7401858,Ampang Hilir, Kuala Lumpur
339,Zehn Bukit Pantai,"8 Jalan Bukit Pantai, Pantai, Bangsar South, Kuala Lumpur",1550000,3,5,2479,Condominium,Leasehold,625.25,https://www.propertyguru.com.my/propertylisting/zehnbukitpantaiforsalebyivanyap36512547,3.1129733,101.6667294,Bangsar South, Kuala Lumpur
340,Zehn Bukit Pantai,"8 Jalan Bukit Pantai, Pantai, Bangsar South, Kuala Lumpur",2000000,4,6,3046,Condominium,Leasehold,656.6,https://www.propertyguru.com.my/propertylisting/zehnbukitpantaiforsalebyivanyap36511653,3.1129733,101.6667294,Bangsar South, Kuala Lumpur
341,Zehn Bukit Pantai,"8 Jalan Bukit Pantai, Pantai, Bangsar South, Kuala Lumpur",2150000,4,6,3509,Condominium,Leasehold,612.71,https://www.propertyguru.com.my/propertylisting/zehnbukitpantaiforsalebyivanyap36510582,3.1129733,101.6667294,Bangsar South, Kuala Lumpur
342,Bukit Jalil Precious & Spacious Lifestyle Freehold SemiD Condo,"Bukit Jalil, Kuala Lumpur",290000,3,2,1100,Condominium,Freehold,263.64,https://www.propertyguru.com.my/propertylisting/bukitjalilpreciousspaciouslifestylefreeholdsemidcondoforsalebymrong31556790,3.0533462,101.6802937,Bukit Jalil, Kuala Lumpur
343,The Harmony @ Old Klang Road,"Old Klang Road (Jalan Klang Lama), Kuala Lumpur",470000,3,2,1033,Condominium,Leasehold,454.99,https://www.propertyguru.com.my/propertylisting/theharmonyoldklangroadforsalebyyevakeng32818377,3.0982804,101.6762084,Old Klang Road (Jalan Klang Lama), Kuala Lumpur
344,Mont Kiara Pines," Jalan Kiara, Mont Kiara, Kuala Lumpur",860000,3,2,1288,Condominium,Freehold,667.7,https://www.propertyguru.com.my/propertylisting/montkiarapinesforsalebyshamalahkodiswaran34948423,3.1699988,101.6521467,Mont Kiara, Kuala Lumpur
345,Seni Mont Kiara," Changkat Duta Kiara, Mont Kiara, Kuala Lumpur",1980000,4,3,2411,Condominium,Freehold,821.24,https://www.propertyguru.com.my/propertylisting/senimontkiaraforsalebyshamalahkodiswaran36690601,3.1699988,101.6521467,Mont Kiara, Kuala Lumpur
346,Villa Wangsamas," Jalan Seri Wangsa 1, Wangsa Maju, Kuala Lumpur",480000,3,3,1270,Condominium,Freehold,377.95,https://www.propertyguru.com.my/propertylisting/villawangsamasforsalebyannhana36649700,3.20568905,101.7319923,Wangsa Maju, Kuala Lumpur
347,Seringin Residences,"8 Jalan Senang Ria, Happy Garden, Kuchai Lama, Kuala Lumpur",1500000,3,4,2128,Condominium,Freehold,704.89,https://www.propertyguru.com.my/propertylisting/seringinresidencesforsalebyailing36648423,3.0894376,101.6846759,Kuchai Lama, Kuala Lumpur
348,Cloud Tree @ Cheras,"Jalan Juara, Cheras, Kuala Lumpur",635000,4,2,1296,Condominium,Freehold,489.97,https://www.propertyguru.com.my/propertylisting/cloudtreecherasforsalebylouistan36276299,3.0991919,101.7374229,Cheras, Kuala Lumpur
349,Waltz Residences,"1 Taman Overseas Union, Jalan Awan Besar, Taman OUG, Kuchai Lama, Kuala Lumpur",780000,4,4,1090,Condominium,Freehold,715.6,https://www.propertyguru.com.my/propertylisting/waltzresidencesforsalebyrhythmchong30537477,3.0894376,101.6846759,Kuchai Lama, Kuala Lumpur
350,Vina Versatile Homes @ Cheras,"Jalan Seri Taming 2a Off Persiaran Minang, Taman Seri Taming, Cheras, Kuala Lumpur",450000,3,3,900,Condominium,Freehold,500,https://www.propertyguru.com.my/propertylisting/vinaversatilehomescherasforsalebyeldachong36644398,3.0991919,101.7374229,Cheras, Kuala Lumpur
351,The Haute Gurney KL,"Jalan Gurney Off Jalan Padang Tembak, Keramat, Kuala Lumpur",520000,3,2,1061,Condominium,Leasehold,490.1,https://www.propertyguru.com.my/propertylisting/thehautegurneyklforsalebyginlow36712636,3.1769852,101.7493586,Keramat, Kuala Lumpur
352,Villa Puteri," Jalan Tun Ismail, KL City, Kuala Lumpur",465000,2,2,1100,Condominium,Freehold,422.73,https://www.propertyguru.com.my/propertylisting/villaputeriforsalebychaoxiang36104874,47.3776542,8.538495,KL City, Kuala Lumpur
