,PropertyName,Address,Price,No_Bedrooms,No_Bathrooms,Floorsize,Property_Type,Tenure,PSF,link,Latitude,Longitude,District,State
353,The Riyang @ Happy Garden,"Jalan Gembira Off Jalan Kuchai Maju, Happy Garden, Kuchai Lama, Kuala Lumpur",890000,4,4,1477,Condominium,Freehold,602.57,https://www.propertyguru.com.my/propertylisting/theriyanghappygardenforsalebydavidting32387522,3.0894376,101.6846759,Kuchai Lama, Kuala Lumpur
354,Le Yuan Residence,"Jalan 6/127a Off Jalan Senang Ria, Happy Garden, Kuchai Lama, Kuala Lumpur",828000,3,3,1535,Condominium,Freehold,539.41,https://www.propertyguru.com.my/propertylisting/leyuanresidenceforsalebyelsisliew35910526,3.0894376,101.6846759,Kuchai Lama, Kuala Lumpur
355,Le Yuan Residence,"Jalan 6/127a Off Jalan Senang Ria, Happy Garden, Kuchai Lama, Kuala Lumpur",735000,3,2,1406,Condominium,Freehold,522.76,https://www.propertyguru.com.my/propertylisting/leyuanresidenceforsalebyelsisliew30726174,3.0894376,101.6846759,Kuchai Lama, Kuala Lumpur
356,Westside III,"Jalan Residen Utama, Desa Parkcity, Kuala Lumpur, Desa ParkCity, Kuala Lumpur",1450000,3,2,1443,Condominium,Freehold,1004.85,https://www.propertyguru.com.my/propertylisting/westsideiiiforsalebyjosephsow36711623,3.1863832,101.6318156,Desa ParkCity, Kuala Lumpur
357,28 Mont Kiara,"32 Jalan Kiara, Mont Kiara, Kuala Lumpur",2150000,3,4,2700,Condominium,Freehold,796.3,https://www.propertyguru.com.my/propertylisting/28montkiaraforsalebyjonathanlee35205716,3.1699988,101.6521467,Mont Kiara, Kuala Lumpur
358,Verve Suites @ Mont Kiara,"5 Jalan Kiara 5, Mont Kiara, Mont Kiara, Kuala Lumpur",600000,1,1,672,Condominium,Freehold,892.86,https://www.propertyguru.com.my/propertylisting/vervesuitesmontkiaraforsalebymonicawong35515617,3.1699988,101.6521467,Mont Kiara, Kuala Lumpur
359,Verve Suites @ Mont Kiara,"5 Jalan Kiara 5, Mont Kiara, Mont Kiara, Kuala Lumpur",528000,1,1,462,Condominium,Freehold,1142.86,https://www.propertyguru.com.my/propertylisting/vervesuitesmontkiaraforsalebymonicawong36350406,3.1699988,101.6521467,Mont Kiara, Kuala Lumpur
360,Quadro Residences," Persiaran KLCC, OFF Jalan Kia Peng, KLCC, KL City, Kuala Lumpur",1700000,3,4,1591,Condominium,Freehold,1068.51,https://www.propertyguru.com.my/propertylisting/quadroresidencesforsalebylisang36490799,47.3776542,8.538495,KL City, Kuala Lumpur
361,Waltz Residences,"1 Taman Overseas Union, Jalan Awan Besar, Taman OUG, Kuchai Lama, Kuala Lumpur",940000,3,3,1250,Condominium,Freehold,752,https://www.propertyguru.com.my/propertylisting/waltzresidencesforsalebyrhythmchong30306601,3.0894376,101.6846759,Kuchai Lama, Kuala Lumpur
362,OUG Condo Move in 2024 near Midvalley *Rental RM3300/Month GRR 3+3 Year* Offer 1st Home Cash 45k,"Old Klang Road (Jalan Klang Lama), Kuala Lumpur",485000,3,2,1079,Condominium,Leasehold,449.49,https://www.propertyguru.com.my/propertylisting/ougcondomovein2024nearmidvalleyrentalrm3300monthgrr33yearoffer1sthomecash45kforsalebyjackyng36117132,3.0982804,101.6762084,Old Klang Road (Jalan Klang Lama), Kuala Lumpur
363,"OUG Condo ""GRR 8% 3+3 Year"" Below Market 30% [near Midvalley OUG, 2024 Move in] Offer 1st House","Old Klang Road (Jalan Klang Lama), Kuala Lumpur",483000,3,2,1069,Condominium,Leasehold,451.82,https://www.propertyguru.com.my/propertylisting/ougcondogrr833yearbelowmarket30nearmidvalleyoug2024moveinoffer1sthouseforsalebyjackyng36113628,3.0982804,101.6762084,Old Klang Road (Jalan Klang Lama), Kuala Lumpur
364,"Legacy OUG Condo [near Midvalley Move in 2024] Offer 1st Home CashRebate 45k, Rental GRR 8% 3+3 Year","Old Klang Road (Jalan Klang Lama), Kuala Lumpur",485000,3,2,1068,Condominium,Leasehold,454.12,https://www.propertyguru.com.my/propertylisting/legacyougcondonearmidvalleymovein2024offer1sthomecashrebate45krentalgrr833yearforsalebyjackyng36114406,3.0982804,101.6762084,Old Klang Road (Jalan Klang Lama), Kuala Lumpur
365,"Tiara Condo Offer 1st Home Cashback 45k, Free MOT (GRR 8% Rental 6 Year) near Pearl point Midvalley","Old Klang Road (Jalan Klang Lama), Kuala Lumpur",486000,3,2,1088,Condominium,Leasehold,446.69,https://www.propertyguru.com.my/propertylisting/tiaracondooffer1sthomecashback45kfreemotgrr8rental6yearnearpearlpointmidvalleyforsalebyjackyng36153071,3.0982804,101.6762084,Old Klang Road (Jalan Klang Lama), Kuala Lumpur
366,"MidVille Condo OUG 0% Downpayment, GRR 8% 6Year, Offer 45k CashBack near Midvalley 1st Home Free MOT","Old Klang Road (Jalan Klang Lama), Kuala Lumpur",486000,3,2,1056,Condominium,Leasehold,460.23,https://www.propertyguru.com.my/propertylisting/midvillecondooug0downpaymentgrr86yearoffer45kcashbacknearmidvalley1sthomefreemotforsalebyjackyng36422251,3.0982804,101.6762084,Old Klang Road (Jalan Klang Lama), Kuala Lumpur
367,Monte Bayu," Jalan Bukit Pandan Bistari 5, Cheras Baru, Cheras, Kuala Lumpur",390000,3,2,1135,Condominium,Leasehold,343.61,https://www.propertyguru.com.my/propertylisting/montebayuforsalebybenlee32931433,3.0991919,101.7374229,Cheras, Kuala Lumpur
368,Anjali North Kiara,"Jalan 3/61 Off Bukit Segambut, Segambut, Kuala Lumpur",1130000,3,4,1856,Condominium,Freehold,608.84,https://www.propertyguru.com.my/propertylisting/anjalinorthkiaraforsalebyrachelong36095331,3.1864418,101.6641964,Segambut, Kuala Lumpur
369,Aira Residence,"Jalan Batai, Damansara Heights, Kuala Lumpur",2950000,3,3,1894,Condominium,Freehold,1557.55,https://www.propertyguru.com.my/propertylisting/airaresidenceforsalebythlee36371783,3.1523954,101.6584455,Damansara Heights, Kuala Lumpur
370,Papillon Desahill Condominium," Jalan Desa Utama, Taman Desa, Kuala Lumpur",2500000,5,4,3600,Condominium,Freehold,694.44,https://www.propertyguru.com.my/propertylisting/papillondesahillcondominiumforsalebyhewsonoh34430384,3.1030637,101.6850208,Taman Desa, Kuala Lumpur
371,28 Mont Kiara,"32 Jalan Kiara, Mont Kiara, Kuala Lumpur",1800000,3,3,2500,Condominium,Freehold,720,https://www.propertyguru.com.my/propertylisting/28montkiaraforsalebychongteckseng34383758,3.1699988,101.6521467,Mont Kiara, Kuala Lumpur
372,Star Residences @ KLCC,"Jalan Yap Kwan Seng, Off Jalan Ampang, KLCC, KL City, Kuala Lumpur",1650000,2,1,808,Condominium,Freehold,2042.08,https://www.propertyguru.com.my/propertylisting/starresidencesklccforsalebymichelleong33228595,47.3776542,8.538495,KL City, Kuala Lumpur
373,ANGGUN RESIDENCES,"ANGGUN JSI, No 8 Jalan Medan Tuanku Utama, Jalan Sultan Ismail, KL City, Kuala Lumpur",774000,1,1,731,Condominium,Freehold,1058.82,https://www.propertyguru.com.my/propertylisting/anggunresidencesforsalebymichelelum36708966,47.3776542,8.538495,KL City, Kuala Lumpur
374,Gallery @ UThant," Jalan Madge, Ampang Hilir, Kuala Lumpur",3000000,5,4,4014,Condominium,Freehold,747.38,https://www.propertyguru.com.my/propertylisting/galleryuthantforsalebyravinderdass34915708,3.1585208,101.7401858,Ampang Hilir, Kuala Lumpur
375,Bayu Angkasa," Jalan Medang Kapas, Bukit Bandaraya, Bangsar, Kuala Lumpur",2100000,3,3,1529,Condominium,Freehold,1373.45,https://www.propertyguru.com.my/propertylisting/bayuangkasaforsalebyravinderdass36513956,3.13083,101.66944,Bangsar, Kuala Lumpur
376,Binjai On The Park,"KLCC, KL City, Kuala Lumpur",4000000,4,4,2250,Condominium,Freehold,1777.78,https://www.propertyguru.com.my/propertylisting/binjaiontheparkforsalebyravinderdass32756882,47.3776542,8.538495,KL City, Kuala Lumpur
377,Mutiara Villa (Bukit Bintang)," Jalan Tingkat Tong Shin, Bukit Bintang, KL City, Kuala Lumpur",349000,1,1,581,Condominium,Freehold,600.69,https://www.propertyguru.com.my/propertylisting/mutiaravillabukitbintangforsalebyjaysensee36636949,47.3776542,8.538495,KL City, Kuala Lumpur
378,Sang Suria," Jalan Ipoh, Sentul, Kuala Lumpur",505000,3,2,1161,Condominium,Freehold,434.97,https://www.propertyguru.com.my/propertylisting/sangsuriaforsalebyravinderdass34472384,3.1786181,101.6954775,Sentul, Kuala Lumpur
379,The Westside One,"No. 1 Jalan Residen Utama, Desa ParkCity, Desa ParkCity, Kuala Lumpur",740000,2,1,969,Condominium,Freehold,763.67,https://www.propertyguru.com.my/propertylisting/thewestsideoneforsalebyvernicechew36707254,3.1863832,101.6318156,Desa ParkCity, Kuala Lumpur
380,Platinum Splendor Residensi Semarak,"Jalan Semarak, Kampung Padang Tembak, Bukit Keramat, Keramat, Kuala Lumpur",460000,3,2,1050,Condominium,Leasehold,438.1,https://www.propertyguru.com.my/propertylisting/platinumsplendorresidensisemarakforsalebydylanlau36699707,3.1769852,101.7493586,Keramat, Kuala Lumpur
381,Casa Green @ Bukit Jalil,"Jalan 5/155, Bukit Jalil, Kuala Lumpur",498888,3,3,1003,Condominium,Leasehold,497.4,https://www.propertyguru.com.my/propertylisting/casagreenbukitjalilforsalebydylanlau36706843,3.0533462,101.6802937,Bukit Jalil, Kuala Lumpur
382,ViPod Residences @ KLCC,"Jalan Kia Peng Off Jalan Raja Chulan, KLCC, KLCC, KL City, Kuala Lumpur",900000,2,1,635,Condominium,Freehold,1417.32,https://www.propertyguru.com.my/propertylisting/vipodresidencesklccforsalebyyeanching35561333,47.3776542,8.538495,KL City, Kuala Lumpur
383,ViPod Residences @ KLCC,"Jalan Kia Peng Off Jalan Raja Chulan, KLCC, KLCC, KL City, Kuala Lumpur",1500000,3,2,1299,Condominium,Freehold,1154.73,https://www.propertyguru.com.my/propertylisting/vipodresidencesklccforsalebyyeanching35560729,47.3776542,8.538495,KL City, Kuala Lumpur
384,St Mary Residences," Jalan Tengah, OFF Jalan Sultan Ismail, KLCC, KL City, Kuala Lumpur",1550000,3,2,1442,Condominium,Freehold,1074.9,https://www.propertyguru.com.my/propertylisting/stmaryresidencesforsalebyyeanching35560400,47.3776542,8.538495,KL City, Kuala Lumpur
385,Solaris Dutamas Designer Suites," Jalan Dutamas 1, Kuala Lumpur, Mont Kiara, Kuala Lumpur",568000,1,1,672,Condominium,Freehold,845.24,https://www.propertyguru.com.my/propertylisting/solarisdutamasdesignersuitesforsalebyaarenyap36706145,3.1699988,101.6521467,Mont Kiara, Kuala Lumpur
386,Scenaria @ North Kiara Hills,"Jalan 6/38a Off Jalan Segambut, Taman Sri Sinar, Segambut, Segambut, Kuala Lumpur",550000,3,2,1019,Condominium,Freehold,539.74,https://www.propertyguru.com.my/propertylisting/scenarianorthkiarahillsforsalebyannieong36443525,3.1864418,101.6641964,Segambut, Kuala Lumpur
387,Mizumi Residences,"Jalan Metro Perdana Barat, Tmn Metropolitan Kepong, Kepong, Kuala Lumpur",465000,3,2,901,Condominium,Leasehold,516.09,https://www.propertyguru.com.my/propertylisting/mizumiresidencesforsalebychaoxiang36579240,3.2140294,101.634842,Kepong, Kuala Lumpur
388,Bayu Tasik Condominium," Jalan Sri Permaisuri 5, Bandar Sri Permaisuri, Cheras, Kuala Lumpur",360000,3,2,920,Condominium,Leasehold,391.3,https://www.propertyguru.com.my/propertylisting/bayutasikcondominiumforsalebyeddiengfuisiang36703738,3.0991919,101.7374229,Cheras, Kuala Lumpur
389,Saville @ Jalan Klang Lama,"128 Jalan Klang Lama, Old Klang Road (Jalan Klang Lama), Kuala Lumpur",680000,4,3,1228,Condominium,Freehold,553.75,https://www.propertyguru.com.my/propertylisting/savillejalanklanglamaforsalebycelineyeo35627353,3.0982804,101.6762084,Old Klang Road (Jalan Klang Lama), Kuala Lumpur
390,Vista Saujana," Taman Wangsa Permai, Sri Damansara, Kepong, Kuala Lumpur",320000,3,2,955,Condominium,Leasehold,335.08,https://www.propertyguru.com.my/propertylisting/vistasaujanaforsalebycelineyeo31476386,3.2140294,101.634842,Kepong, Kuala Lumpur
391,Laman Ceylon," Jalan Ceylon, Bukit Bintang, Bukit Bintang, KL City, Kuala Lumpur",880000,2,2,947,Condominium,Freehold,929.25,https://www.propertyguru.com.my/propertylisting/lamanceylonforsalebysureshabraham30784868,47.3776542,8.538495,KL City, Kuala Lumpur
392,Le Yuan Residence,"Jalan 6/127a Off Jalan Senang Ria, Happy Garden, Kuchai Lama, Kuala Lumpur",699000,2,2,1164,Condominium,Freehold,600.52,https://www.propertyguru.com.my/propertylisting/leyuanresidenceforsalebyelsisliew36413565,3.0894376,101.6846759,Kuchai Lama, Kuala Lumpur
393,Le Yuan Residence,"Jalan 6/127a Off Jalan Senang Ria, Happy Garden, Kuchai Lama, Kuala Lumpur",745000,3,2,1392,Condominium,Freehold,535.2,https://www.propertyguru.com.my/propertylisting/leyuanresidenceforsalebyelsisliew32369194,3.0894376,101.6846759,Kuchai Lama, Kuala Lumpur
394,Villa Wangsamas," Jalan Seri Wangsa 1, Wangsa Maju, Kuala Lumpur",800000,6,5,2567,Condominium,Freehold,311.65,https://www.propertyguru.com.my/propertylisting/villawangsamasforsalebyjanehew36533119,3.20568905,101.7319923,Wangsa Maju, Kuala Lumpur
395,Petalz Residences @ Old Klang Road,"Jalan Klang Lama, Off New Pantai Expressway (NPE), Old Klang Road (Jalan Klang Lama), Kuala Lumpur",600000,3,2,935,Condominium,Freehold,641.71,https://www.propertyguru.com.my/propertylisting/petalzresidencesoldklangroadforsalebyashleysaw36215696,3.0982804,101.6762084,Old Klang Road (Jalan Klang Lama), Kuala Lumpur
396,Vista Mutiara,"No.1 Jalan Kepong, Kepong, Kuala Lumpur",380000,3,2,1200,Condominium,Leasehold,316.67,https://www.propertyguru.com.my/propertylisting/vistamutiaraforsalebyshonjuwong36502303,3.2140294,101.634842,Kepong, Kuala Lumpur
397,Kiara 1888,"Jalan Kiara 3, Kampung Segambut Dalam, Mont Kiara, Kuala Lumpur",1180000,5,3,1900,Condominium,Freehold,621.05,https://www.propertyguru.com.my/propertylisting/kiara1888forsalebyjuliantong34280929,3.1699988,101.6521467,Mont Kiara, Kuala Lumpur
398,The Z Residence,"Jalan 5/155, Taman Industri Bukit OUG, Bukit Jalil, Bukit Jalil, Kuala Lumpur",770000,3,2,1410,Condominium,Freehold,546.1,https://www.propertyguru.com.my/propertylisting/thezresidenceforsalebycedricgomez36338468,3.0533462,101.6802937,Bukit Jalil, Kuala Lumpur
399,The Address @ Taman Desa,"Jalan Desa Bakti, Old Klang Road (Taman Desa), Taman Desa, Kuala Lumpur",748000,3,3,1118,New Project,Unknown,669.05,https://www.propertyguru.com.my/propertylisting/theaddresstamandesaforsalebygerisia36560875,3.1030637,101.6850208,Taman Desa, Kuala Lumpur
400,Solaris Dutamas Designer Suites," Jalan Dutamas 1, Kuala Lumpur, Mont Kiara, Kuala Lumpur",568000,1,1,672,Condominium,Freehold,845.24,https://www.propertyguru.com.my/propertylisting/solarisdutamasdesignersuitesforsalebycalvinpoh36701788,3.1699988,101.6521467,Mont Kiara, Kuala Lumpur
401,Seasons Garden Residences @ Wangsa Maju,"Jalan 26/26, Taman Setapak Jaya, Seksyen 10 Wangsa Maju, Wangsa Maju, Kuala Lumpur",550000,4,2,815,Condominium,Leasehold,674.85,https://www.propertyguru.com.my/propertylisting/seasonsgardenresidenceswangsamajuforsalebyjeslywong36696035,3.20568905,101.7319923,Wangsa Maju, Kuala Lumpur
402,Sentul Point Suite Apartment,"Jalan Sentul Pasar, Sentul, Kuala Lumpur",518800,3,2,850,Apartment,Freehold,610.35,https://www.propertyguru.com.my/propertylisting/sentulpointsuiteapartmentforsalebycheeleng36685321,3.1786181,101.6954775,Sentul, Kuala Lumpur
403,Pearl Suria,"Jalan Sepadu Off Taman United, Old Klang Road (Jalan Klang Lama), Kuala Lumpur",525000,2,2,860,Condominium,Leasehold,610.47,https://www.propertyguru.com.my/propertylisting/pearlsuriaforsalebyashleysaw35921797,3.0982804,101.6762084,Old Klang Road (Jalan Klang Lama), Kuala Lumpur
404,Kenny Hills Residence,"Jalan Tun Ismail Off Jalan Tunku, Bukit Tunku (Kenny Hills), Kenny Hills (Bukit Tunku), Bukit Tunku, Kuala Lumpur",4380000,5,5,6738,Condominium,Freehold,650.04,https://www.propertyguru.com.my/propertylisting/kennyhillsresidenceforsalebyyvonechong32586333,3.1665811,101.6806678,Bukit Tunku, Kuala Lumpur
405,Pinggiran Kiara," Jalan Datuk Sulaiman 6, Taman Tun Dr Ismail, Kuala Lumpur",830000,2,2,1188,Condominium,Freehold,698.65,https://www.propertyguru.com.my/propertylisting/pinggirankiaraforsalebyyinpeng35161549,3.1508079,101.6249189,Taman Tun Dr Ismail, Kuala Lumpur
406,Apartment Pelangi Magna Metro Prima Kepong KL,"Kepong, Kuala Lumpur",199000,3,2,724,Apartment,Leasehold,274.86,https://www.propertyguru.com.my/propertylisting/apartmentpelangimagnametroprimakepongklforsalebyfaridshamsuddin36687966,3.2140294,101.634842,Kepong, Kuala Lumpur
407,Cloud Tree @ Cheras,"Jalan Juara, Cheras, Kuala Lumpur",699000,4,3,1545,Condominium,Freehold,452.43,https://www.propertyguru.com.my/propertylisting/cloudtreecherasforsalebyjaysonchong36690414,3.0991919,101.7374229,Cheras, Kuala Lumpur
408,"J. Dupion, Cheras","12 Jalan Sembilang, Taman Tenaga, Taman Tenaga Taman Tenaga, Cheras, Kuala Lumpur",518000,2,2,804,Condominium,Freehold,644.28,https://www.propertyguru.com.my/propertylisting/jdupioncherasforsalebyericchong33834721,3.0991919,101.7374229,Cheras, Kuala Lumpur
409,Ketumbar Hill," Jalan Ketumbar, Taman Cheras, Cheras, Kuala Lumpur",450000,3,2,1200,Condominium,Freehold,375,https://www.propertyguru.com.my/propertylisting/ketumbarhillforsalebyponylow36555890,3.0991919,101.7374229,Cheras, Kuala Lumpur
410,Quill Residences,"Jalan Sultan Ismail, Jalan Sultan Ismail, KL City, Kuala Lumpur",736800,1,1,667,Condominium,Freehold,1104.65,https://www.propertyguru.com.my/propertylisting/quillresidencesforsalebychrisling36577474,47.3776542,8.538495,KL City, Kuala Lumpur
411,Verve Suites @ KL South,"Jalan Klang Lama, Old Klang Road (Jalan Klang Lama), Kuala Lumpur",590000,2,2,703,Condominium,Freehold,839.26,https://www.propertyguru.com.my/propertylisting/vervesuitesklsouthforsalebyafiqshuhaimi36643015,3.0982804,101.6762084,Old Klang Road (Jalan Klang Lama), Kuala Lumpur
412,Verve Suites @ KL South,"Jalan Klang Lama, Old Klang Road (Jalan Klang Lama), Kuala Lumpur",610000,2,2,729,Condominium,Freehold,836.76,https://www.propertyguru.com.my/propertylisting/vervesuitesklsouthforsalebyafiqshuhaimi36643411,3.0982804,101.6762084,Old Klang Road (Jalan Klang Lama), Kuala Lumpur
413,Verve Suites @ KL South,"Jalan Klang Lama, Old Klang Road (Jalan Klang Lama), Kuala Lumpur",700000,2,2,876,Condominium,Freehold,799.09,https://www.propertyguru.com.my/propertylisting/vervesuitesklsouthforsalebyafiqshuhaimi36643675,3.0982804,101.6762084,Old Klang Road (Jalan Klang Lama), Kuala Lumpur
414,Scenaria @ North Kiara Hills,"Jalan 6/38a Off Jalan Segambut, Taman Sri Sinar, Segambut, Segambut, Kuala Lumpur",610000,3,2,1019,Condominium,Freehold,598.63,https://www.propertyguru.com.my/propertylisting/scenarianorthkiarahillsforsalebyvincent36636406,3.1864418,101.6641964,Segambut, Kuala Lumpur
415,Suria Jelatek Residence,"Jalan Jelatek, Ampang Hilir, Jalan Ampang, KL City, Kuala Lumpur",550000,3,2,1421,Condominium,Leasehold,387.05,https://www.propertyguru.com.my/propertylisting/suriajelatekresidenceforsalebymuhammadasyrafshabarshah36700007,47.3776542,8.538495,KL City, Kuala Lumpur
416,The Henge Kepong,"The Henge Jalan Metro Perdana Barat, Taman Usahawan Kepong, Kepong, Kuala Lumpur",449000,3,2,1100,Condominium,Leasehold,408.18,https://www.propertyguru.com.my/propertylisting/thehengekepongforsalebycharmainetan36286458,3.2140294,101.634842,Kepong, Kuala Lumpur
417,Stonor 3 @ KLCC,"Stonor 3 Lorong Stonor Off Persiaran Stonor, KLCC, KL City, Kuala Lumpur",1350000,3,2,1031,Condominium,Freehold,1309.41,https://www.propertyguru.com.my/propertylisting/stonor3klccforsalebyjaydenyong36698467,47.3776542,8.538495,KL City, Kuala Lumpur
418,"kuchai lama MRT Project 2 station to TRX, 5 station to KLCC , Walking distance to MRT","Old Klang Road (Kuchai Lama), Kuchai Lama, Kuala Lumpur",300000,2,1,550,Condominium,Leasehold,545.45,https://www.propertyguru.com.my/propertylisting/kuchailamamrtproject2stationtotrx5stationtoklccwalkingdistancetomrtforsalebypayeelim36657453,3.0894376,101.6846759,Kuchai Lama, Kuala Lumpur
419,South Brooks,"Jalan Residen Utama, ParkCity Heights, Desa ParkCity, Kuala Lumpur",1100000,3,2,1194,Condominium,Freehold,921.27,https://www.propertyguru.com.my/propertylisting/southbrooksforsalebytonyong36435469,3.1863832,101.6318156,Desa ParkCity, Kuala Lumpur
420,Villa Wangsamas,"Jalan Seri Wangsa 1, Wangsa Maju, Kuala Lumpur",460000,4,3,1267,Condominium,Freehold,363.06,https://www.propertyguru.com.my/propertylisting/villawangsamasforsalebyjctai34654246,3.20568905,101.7319923,Wangsa Maju, Kuala Lumpur
421,Ceriaan Kiara,"Jalan Kiara 3, Aman Kiara, Mont Kiara, Kuala Lumpur",1330000,3,4,3639,Condominium,Freehold,365.49,https://www.propertyguru.com.my/propertylisting/ceriaankiaraforsalebychongyenling33463060,3.1699988,101.6521467,Mont Kiara, Kuala Lumpur
422,Pearl Suria,"Jalan Sepadu Off Taman United, Old Klang Road (Jalan Klang Lama), Kuala Lumpur",525000,2,2,860,Condominium,Leasehold,610.47,https://www.propertyguru.com.my/propertylisting/pearlsuriaforsalebyashleysaw35386969,3.0982804,101.6762084,Old Klang Road (Jalan Klang Lama), Kuala Lumpur
423,Pearl Suria,"Jalan Sepadu Off Taman United, Old Klang Road (Jalan Klang Lama), Kuala Lumpur",680000,3,2,1202,Condominium,Leasehold,565.72,https://www.propertyguru.com.my/propertylisting/pearlsuriaforsalebyashleysaw35917970,3.0982804,101.6762084,Old Klang Road (Jalan Klang Lama), Kuala Lumpur
424,Parkhill Residence Bukit Jalil,"Jalan Teknologi 1, Technology Park Malaysia, Bukit Jalil, Kuala Lumpur",555000,3,2,1100,Condominium,Leasehold,504.55,https://www.propertyguru.com.my/propertylisting/parkhillresidencebukitjalilforsalebyweewan36667391,3.0533462,101.6802937,Bukit Jalil, Kuala Lumpur
425,Seni Mont Kiara," Changkat Duta Kiara, Mont Kiara, Kuala Lumpur",2000000,3,3,2411,Condominium,Freehold,829.53,https://www.propertyguru.com.my/propertylisting/senimontkiaraforsalebyxinziyew36697066,3.1699988,101.6521467,Mont Kiara, Kuala Lumpur
426,One KL,"6 Jalan Pinang, KLCC, KL City, Kuala Lumpur",3600000,4,5,3285,Condominium,Freehold,1095.89,https://www.propertyguru.com.my/propertylisting/oneklforsalebyphuakinhin35559478,47.3776542,8.538495,KL City, Kuala Lumpur
427,Mutiara Villa (Bukit Bintang)," Jalan Tingkat Tong Shin, Bukit Bintang, KL City, Kuala Lumpur",430000,2,1,785,Condominium,Freehold,547.77,https://www.propertyguru.com.my/propertylisting/mutiaravillabukitbintangforsalebyjaysensee36636896,47.3776542,8.538495,KL City, Kuala Lumpur
428,Meadow Park 2,"Jalan 1/130, Taman Gembira, Wilayah Persekutuan Ku, Happy Garden, Kuchai Lama, Kuala Lumpur",270000,3,2,932,Condominium,Freehold,289.7,https://www.propertyguru.com.my/propertylisting/meadowpark2forsalebyweewan36621456,3.0894376,101.6846759,Kuchai Lama, Kuala Lumpur
429,Stonor Park," Jalan Stonor, KL City, Kuala Lumpur",2700000,4,5,3228,Condominium,Freehold,836.43,https://www.propertyguru.com.my/propertylisting/stonorparkforsalebydavesidhu36672645,47.3776542,8.538495,KL City, Kuala Lumpur
430,288 Residency," Jalan 1/50, Off Jalan Gombak, Taman P Ramlee, Setapak, Kuala Lumpur",530000,3,2,1215,Condominium,Freehold,436.21,https://www.propertyguru.com.my/propertylisting/288residencyforsalebydanielwu34594539,3.1975774,101.7139655,Setapak, Kuala Lumpur
431,Palace Court,"10 Jalan 3/115c Off Jalan Kuchai Lama, Taman Kuchai J, Kuchai Lama, Kuala Lumpur",380000,2,2,936,Condominium,Leasehold,405.98,https://www.propertyguru.com.my/propertylisting/palacecourtforsalebydanielwu36263349,3.0894376,101.6846759,Kuchai Lama, Kuala Lumpur
432,Vista Komanwel B,"Jln Jalil Perkasa 19, Bukit Jalil, Bukit Jalil, Kuala Lumpur",460000,3,2,1224,Condominium,Freehold,375.82,https://www.propertyguru.com.my/propertylisting/vistakomanwelbforsalebydarrenwong32188730,3.0533462,101.6802937,Bukit Jalil, Kuala Lumpur
433,Arte @ Kuchai Lama,"Jalan 1/116c Off Jalan Kuchai Maju, Kuchai Entrepreneurs Park, Kuchai Lama, Kuala Lumpur",678000,4,3,1732,Condominium,Leasehold,391.45,https://www.propertyguru.com.my/propertylisting/artekuchailamaforsalebydanielwu36695495,3.0894376,101.6846759,Kuchai Lama, Kuala Lumpur
434,Sri Putramas,"Jalan Kuching, Jalan Kuching, KL City, Kuala Lumpur",400000,3,2,1100,Condominium,Freehold,363.64,https://www.propertyguru.com.my/propertylisting/sriputramasforsalebymohdyazzer36637971,47.3776542,8.538495,KL City, Kuala Lumpur
435,Dynasty Garden Condominium,"Jalan Kuchai Maju 9, Kuchai Entrepreneurs Park, Old Klang Road (Jalan Klang Lama), Kuala Lumpur",430000,3,2,1120,Condominium,Leasehold,383.93,https://www.propertyguru.com.my/propertylisting/dynastygardencondominiumforsalebydanielwu36695391,3.0982804,101.6762084,Old Klang Road (Jalan Klang Lama), Kuala Lumpur
436,Vista Komanwel C," OFF Jalan Barat, Bandar Bukit Jalil, Bukit Jalil, Kuala Lumpur",450000,3,2,1224,Apartment,Freehold,367.65,https://www.propertyguru.com.my/propertylisting/vistakomanwelcforsalebydarrenwong32151689,3.0533462,101.6802937,Bukit Jalil, Kuala Lumpur
437,Kuchai Avenue," Jalan 2/116b, Kuchai Lama, Kuala Lumpur",390000,3,2,935,Apartment,Freehold,417.11,https://www.propertyguru.com.my/propertylisting/kuchaiavenueforsalebydanielwu36695285,3.0894376,101.6846759,Kuchai Lama, Kuala Lumpur
438,Vista Angkasa," Jalan Kerinchi, Kampung Kerinchi, KL City, Kuala Lumpur",375000,4,2,1000,Apartment,Leasehold,375,https://www.propertyguru.com.my/propertylisting/vistaangkasaforsalebyshamsiahajmain35185786,47.3776542,8.538495,KL City, Kuala Lumpur
439,Vista Komanwel A," Jalan Barat, Bandar Bukit Jalil, Bukit Jalil, Kuala Lumpur",368000,3,2,1252,Condominium,Freehold,293.93,https://www.propertyguru.com.my/propertylisting/vistakomanwelaforsalebydarrenwong32420908,3.0533462,101.6802937,Bukit Jalil, Kuala Lumpur
440,Gembira Residen (G Residence),"Jalan Senang Ria, Off Jalan Gembira, Happy Garden, Kuchai Lama, Kuala Lumpur",658999,3,3,1392,Condominium,Freehold,473.42,https://www.propertyguru.com.my/propertylisting/gembiraresidengresidenceforsalebydanielwu36561394,3.0894376,101.6846759,Kuchai Lama, Kuala Lumpur
441,Gembira Residen (G Residence),"Jalan Senang Ria, Off Jalan Gembira, Happy Garden, Kuchai Lama, Kuala Lumpur",670000,3,2,1168,Condominium,Freehold,573.63,https://www.propertyguru.com.my/propertylisting/gembiraresidengresidenceforsalebydanielwu36561319,3.0894376,101.6846759,Kuchai Lama, Kuala Lumpur
442,"Lexa Residence @ The Quartz, Wangsa Maju","Jalan 34/26 Jalan 34/26, Wangsa Maju, Kuala Lumpur",500000,3,2,819,Condominium,Freehold,610.5,https://www.propertyguru.com.my/propertylisting/lexaresidencethequartzwangsamajuforsalebymaxgan32128039,3.20568905,101.7319923,Wangsa Maju, Kuala Lumpur
